,meal_type,food_name,food_id,serving_id,calories
9523,Breakfast,"Seafood Soup with Potatoes and Vegetables (Including Carrots, Broccoli, and/or Dark-Green Leafy)",3063,9510,151
10003,Breakfast,"Cooked Turnip Greens with Roots (from Fresh, Fat Added in Cooking)",5995,20400,71
498,Dinner,"Beef Chuck (Cold Roast, Lean Only, Trimmed to 1/4"" Fat, Choice Grade)",37664,36500,585
4733,Breakfast,Instant Brown Rice,4534,18429,233
720,Breakfast,"Beef Ribs (Small End, Trimmed to 1/8"" Fat, Prime Grade, Cooked, Broiled)",37594,36350,301
8049,Breakfast,Oatmeal Sandwich Cookie with Creme Filling,4008,14808,73
9342,Breakfast,Cream of Asparagus Soup (Prepared with Water),6981,25386,85
6424,Breakfast,"Chocolate Devil's Food or Fudge Cake without Icing, Coating or Filling (Eggs and Water Added to Dry Mix)",3820,15773,234
6875,Breakfast,"Cooked Turnip (from Frozen, Fat Not Added in Cooking)",6626,26506,36
3089,Dinner,Veal Shoulder Arm,38545,38071,401
8098,Breakfast,Tuna Maki,4310080,4195488,26
8188,Breakfast,Diet Gelatin Dessert with Fruit and Sour Cream (Sweetened with Low Calorie Sweetener),7383,27247,162
9140,Breakfast,Dried or Dehydrated Chives,6410,23766,48
596,Breakfast,Beef Lungs,37327,35855,26
9600,Breakfast,"Beets (Drained, Cooked, Boiled)",36284,33953,37
6836,Breakfast,"Cooked Summer Squash (from Fresh, Fat Not Added in Cooking)",6616,24531,36
6792,Breakfast,Cooked Tomato with Corn and Okra (Fat Not Added in Cooking),6202,23714,78
5164,Breakfast,"Apple Cider-Flavored Drink (Powder, Low Calorie, with Vitamin C)",40759,41744,2
9656,Breakfast,"Beef, Potatoes and Vegetables Soup (Mixture)",2439,8716,340
1647,Breakfast,"Low Sodium Vegetable Chicken Soup (Prepared with Water, Canned)",6984,25738,166
6876,Breakfast,"Cooked Turnip (from Canned, Fat Not Added in Cooking)",6685,24535,34
7760,Breakfast,Spice Cake without Icing,3890,15121,144
2700,Breakfast,"Bean Soup with Vegetables, Rice and Pork",3306,10783,187
8254,Breakfast,Pannetone (Italian-Style Sweetbread),3564,12181,86
1700,Lunch,"Chicken with Gravy, Dressing, Rice, Vegetable and Dessert (Frozen Meal, Large Meat)",2907,12848,880
9587,Breakfast,"Butternut Winter Squash (with Salt, Cooked, Baked)",36891,35026,82
5404,Breakfast,"Boysenberries (Heavy Syrup, Canned)",35765,32996,225
8089,Breakfast,"Chocolate Sandwich Cookies (with Creme Filling, Chocolate Coated)",38890,38799,82
6653,Breakfast,"Minestrone Soup (Dry, Dehydrated)",34800,31654,61
2942,Breakfast,Fried Veal Cutlet or Steak (Lean Only Eaten),1588,3988,205
7845,Breakfast,Rice Soup,5206,18695,58
7073,Breakfast,"Cooked Vegetable Type Stew (Including Potatoes, Carrots, Onions and Celery, Fat Added in Cooking)",6710,26448,116
86,Breakfast,"Beef Inside Skirt Steak (Trimmed to 1/4"" Fat)",40376,41247,231
2308,Breakfast,Chocolate Chip Cookies (Special Dietary),38918,38867,32
2677,Breakfast,Pork Sandwich with Gravy,2805,8785,325
8675,Breakfast,Skim Evaporated Milk (Undiluted),836,56,200
8654,Breakfast,"Chinese Cabbage (Pe-Tsai) (Without Salt, Drained, Cooked, Boiled)",36317,34029,17
2594,Breakfast,"Pork Fat (From Ham and Arm Picnic, Cured)",36159,33740,164
6962,Breakfast,Cooked Kale (Fat Not Added in Cooking),5919,22976,36
1029,Breakfast,Lowfat Beef and Pork Bologna,1868,5805,64
136,Breakfast,"Beef Knuckle (Tip Side, Steak, Trimmed to 0"" Fat)",40329,41169,267
7664,Breakfast,Sweet Potato (Frozen),36622,34595,169
6887,Breakfast,"Cooked Broccoli (from Frozen, Fat Not Added in Cooking)",6011,22355,52
2854,Breakfast,Cotto Salami,307716,342611,58
4409,Breakfast,"Salmon Nuggets (Breaded, Frozen, Heated)",38209,45185,60
1200,Breakfast,Chicken Wing with Hot Pepper Sauce,2259,7355,73
6121,Breakfast,"Green Pea Soup Mix (with Equal Volume Water, Dehydrated)",35011,32014,133
4717,Breakfast,Steamed or Boiled Squid,2130,8040,30
10048,Breakfast,Jalapeo Poppers,22836504,21380105,204
10131,Breakfast,Cooked Vegetable Combinations with Butter Sauce and Pasta,6879,25477,230
566,Breakfast,"Beef Flank (Lean Only, Trimmed to 0"" Fat, Choice Grade, Cooked, Broiled)",37185,44807,165
8143,Dinner,Chimichanga with Beef and Cheese,39908,40515,443
5933,Breakfast,Pear Unsweetened in Water Pack (Cooked or Canned),5460,21111,22
5430,Breakfast,Sweetened Frozen Blackberries,5497,20308,115
5868,Breakfast,Watermelon,5491,21036,46
3927,Dinner,Mexican Sweet Roll with Raisins and Icing (Pan Dulce),3529,12580,359
6195,Breakfast,Graham Crackers with Raisins,4269,16691,61
6794,Breakfast,"Low Sodium Boiled Potato (without Peel, Fat Not Added in Cooking, Canned)",5733,20209,112
8342,Breakfast,Quick Grits (Fat Added in Cooking),4457,17847,225
7237,Dinner,Frozen Breakfast (Frozen Meal),5200,18694,373
7381,Breakfast,"Cooked Corn with Cream Sauce (made with Milk, from Frozen)",6758,24263,260
8438,Breakfast,Bison Meat (Lean Only),38575,38129,31
7342,Breakfast,Fried Corn Flour Patty or Tart,3732,14922,22
9414,Breakfast,"Consomme Soup (with Gelatin, with Equal Volume Water, Dehydrated)",35005,31998,17
8736,Breakfast,"Cooked Pinto, Calico or Red Beans (Fat Added in Cooking)",3202,11671,313
2330,Breakfast,"Pork Chops (Loin Blade, Bone-In, Cooked, Pan-Fried)",36170,33757,291
3515,Dinner,"Bacon Cheeseburger with 1/4 Lb Meat, Mayonnaise or Salad Dressing and Tomatoes on Bun",2738,8840,668
2187,Breakfast,"Lamb Shoulder Blade (Trimmed to 1/4"" Fat, Choice Grade, Cooked, Broiled)",38476,37933,236
195,Breakfast,"Beef Tip Round (Lean Only, Trimmed to 1/4"" Fat, Select Grade)",37274,35755,34
8136,Dinner,Loaded Cauliflower,16586732,15656138,513
6357,Breakfast,Cooked Dry Red Kidney Beans (Fat Added in Cooking),3205,11289,331
5059,Breakfast,Instant White Rice (Fat Not Added in Cooking),4505,18427,191
802,Breakfast,"Beef Tenderloin (Lean Only, Trimmed to 1/8"" Fat, Cooked, Broiled)",40434,41361,57
5715,Breakfast,Grapefruit and Orange Sections,5262,17129,85
9614,Breakfast,"Beets (Drained Solids, Canned)",36286,33960,2
241,Breakfast,"Beef Ribs (Whole, Trimmed to 1/4"" Fat)",37186,35582,89
2068,Breakfast,"Lamb or Mutton, Rice and Vegetables in Gravy (Including Carrots, Broccoli, and/or Dark-Green Leafy)",2492,8289,255
6495,Breakfast,Tapioca Puddings (Dry Mix),39457,39975,339
9235,Breakfast,"Tomato Bisque (with Equal Volume Milk, Canned)",34952,31871,198
644,Lunch,"Beef Retail Cuts Composite (Trimmed to 1/4"" Fat, Cooked)",37143,35504,869
9897,Breakfast,Dill Cucumber Pickles,6794,25695,12
5103,Dinner,"White Rice (Long-Grain, Dry, Enriched, Precooked or Instant)",39722,40328,361
5460,Lunch,Cherry Crisp,4163,14600,701
1637,Breakfast,Chicken or Turkey Stew with Potatoes and Vegetables in Gravy,2511,9900,189
120,Breakfast,"Beef Brisket (Flat Half, Lean Only, Trimmed to 1/8"" Fat, Select Grade)",40466,41421,141
5873,Breakfast,Papayas,35897,33250,55
2981,Breakfast,Turkey Dark Meat and Skin,34568,42541,136
5069,Breakfast,White and Wild Rice,4525,19208,188
3074,Breakfast,"Veal Leg (Top Round, Cooked, Braised)",38518,38017,179
9430,Breakfast,Cooked Artichoke (Fat Added in Cooking),6395,24318,69
3278,Breakfast,Egg Dinner Rolls,39049,39240,107
2135,Breakfast,Lamb Shoulder Chop (Lean Only Eaten),1551,4509,145
8693,Dinner,Poultry From Backs and Necks Without Skin,34674,31434,452
4970,Breakfast,Pasta with Tomato Sauce and Frankfurters or Hot Dogs (Canned),5020,19377,263
6952,Breakfast,Cooked Japanese Radish (Daikon) (Fat Not Added in Cooking),6731,23413,28
134,Breakfast,"Beef Retail Cuts Composite (Lean Only, Trimmed to 1/4"" Fat, Select Grade)",37154,35524,120
4351,Breakfast,Yellowfin Tuna (Fish),38088,37302,31
5324,Breakfast,Banana Pancakes,12221423,11599974,70
10180,Breakfast,Lard and Vegetable Oil Shortening,34285,30626,115
6909,Breakfast,Lowfat Cholesterol Free Cupcake with Fruit and Cream Filling (Not Chocolate),3844,12435,118
2559,Breakfast,Oriental Style Pork (Dehydrated),40730,46814,174
62,Breakfast,Beef and Noodles with Gravy (Mixture),2319,10397,304
10505,Dinner,Mimosa Salad,2588895,2527747,571
1358,Breakfast,Chicken Drumstick Meat and Skin (Broilers or Fryers),34451,30979,118
7356,Dinner,Puerto Rican Style Stuffed Cabbage with Meat (Repollo Relleno Con Carne),7139,26567,524
7222,Breakfast,Hard Peanut Granola Bars,39304,39657,136
8758,Breakfast,"Red Tomatoes (No Salt Added, Canned)",36908,35046,46
2467,Breakfast,Mexican Style Pork Stew (Cerdo Guisado Sin Papas),2225,9061,290
679,Breakfast,"Beef Ribs (Large End, Trimmed to 1/8"" Fat)",37572,36304,90
7624,Breakfast,Potato Only From Puerto Rican Mixed Dishes,5739,20211,108
741,Breakfast,"Beef Ribs (Whole, Trimmed to 1/4"" Fat, Prime Grade, Cooked, Roasted)",37197,35605,348
5307,Breakfast,Chinese Banana,5391,20716,56
6266,Breakfast,"Taco or Tostada with Beef, Lettuce, Tomato and Salsa",4824,18056,144
9997,Breakfast,Cooked Turnip Greens with Roots (Fat Added in Cooking),5994,20300,66
3641,Breakfast,Oat Bran Cereal made with Milk (Fat Added in Cooking),4574,18355,269
444,Breakfast,Beef Steak (Lean and Fat Eaten),1359,1256,71
8621,Dinner,Oatmeal Pie,4135,15274,445
3258,Breakfast,White Bread,3433,9914,69
4663,Breakfast,Shellfish Mixture and Noodles in Tomato-Based Sauce (Mixture),2416,10202,253
1873,Breakfast,Non Alcoholic Wine,37958,37026,2
7146,Breakfast,Baked Taro,5856,22126,190
2596,Breakfast,"Pork Feet (Cured, Pickled)",36142,33709,58
1717,Breakfast,Chunky Chicken Noodle Soup (Canned),34738,31529,175
2912,Breakfast,"Turkey Sausage (Reduced Fat, Cooked)",35177,32310,256
2843,Breakfast,Turkey Leg Meat (Fryer-Roasters),34608,31305,100
4027,Lunch,"Nachos with Beef, Beans, Cheese and Sour Cream",4848,17043,1598
5488,Dinner,Cherry Pie,299695,334828,390
9116,Breakfast,"Seafood Garden Salad with Seafood (Eggs, Vegetables Excluding Tomato and Carrots)",2676,10225,52
4485,Breakfast,Mullet,2016,8788,33
2556,Breakfast,"Mexican Style Stewed, Seasoned, Ground Beef and Pork (Picadillo De Carne De Rez Y Puerco)",2302,9121,329
489,Breakfast,"Beef Chuck (Clod Steak, Lean Only, Trimmed to 0"" Fat, Select Grade, Cooked, Braised)",37674,36516,162
493,Dinner,"Beef Chuck (Clod Steak, Trimmed to 1/4"" Fat, Choice Grade)",40372,41238,685
690,Dinner,"Beef Ribs (Small End, Lean Only, Trimmed to 0"" Fat, Cooked, Broiled)",37382,35950,450
7233,Breakfast,Instant Breakfast Powder (with Milk),942,340,222
3821,Breakfast,Oat Bran Muffins,39001,39123,305
602,Dinner,"Beef Outside Round (Steak, Trimmed to 0"" Fat, Cooked, Grilled)",40338,41182,430
1911,Breakfast,Duck (Skin Not Eaten),1790,5760,126
1014,Breakfast,Smoked or Cured Bacon,1518,3575,27
6903,Dinner,Puerto Rican Style Stuffed Pot Roast (Assume with Gravy and Stuffing),2215,8091,360
1993,Breakfast,Smoked or Cured Ham (Canned),1498,2841,30
8772,Breakfast,"Sweet Red Peppers (Chopped, with Salt, Frozen, Drained, Cooked, Boiled)",36942,44687,5
3757,Breakfast,"Toasted English Muffins (Includes Sourdough, with Calcium Propionate, Enriched)",38978,39067,140
2366,Breakfast,Keto Sausage Balls,23428402,21886763,76
5283,Breakfast,Fried Apricot Pie,4062,15300,314
4370,Breakfast,Fish and Vegetable Soup (Sopa De Pescado),3046,9819,100
7720,Breakfast,Torte Cake,3899,13552,222
8539,Breakfast,Sugar Free Cola  Soft Drink,7497,28275,7
1361,Breakfast,"Chicken Drumstick Meat and Skin (Broilers or Fryers, Roasted, Cooked)",34454,30986,112
6713,Breakfast,Hot Dog Pickle Relish,36963,35157,14
1526,Breakfast,Chicken Fried Rice,5100,20523,329
1327,Breakfast,Chicken Dark Meat and Skin (Broilers or Fryers),34419,42392,202
6822,Breakfast,Cooked Sauerkraut (Fat Not Added in Cooking),6594,25546,27
8065,Dinner,Ham and Tomato Club Sandwich with Lettuce and Spread,2806,11181,605
1551,Dinner,Chicken Enchilada (Diet Frozen Meal),5195,20780,354
7036,Breakfast,"Cream of Onion Soup (Undiluted, Canned)",6903,25486,221
10228,Breakfast,Cooked Mushrooms (from Frozen),6454,23402,77
1337,Breakfast,"Chicken Dark Meat (Broilers or Fryers, Fried, Cooked)",34429,42402,203
3901,Breakfast,Toasted Sweet Roll,3515,11437,180
3010,Breakfast,Turkey Light Meat (Young Tom),34650,42623,129
5041,Breakfast,Spanish Rice,5157,20007,211
9323,Breakfast,Butterscotch or Caramel Toppings,39574,40137,103
2250,Breakfast,Smoked or Cured Pork Chop (Lean and Fat Eaten),1457,1170,129
10095,Breakfast,Mashed Potatoes (Whole Milk Added),36710,34747,174
5039,Breakfast,White Rice,4501,16834,204
2346,Breakfast,"Pork Chops (Sirloin, Bone-In, Cooked, Broiled)",36073,33588,220
9800,Breakfast,Cooked Celery,6408,23604,60
5485,Breakfast,"Sweet Cherries (Solids and Liquids, Extra Heavy Syrup Pack, Canned)",35782,33026,266
9368,Breakfast,Cocoa Powder Mix (with Water),37808,36738,113
2784,Dinner,"Turkey Giblets and Neck Meat and Skin (Cooked, Roasted)",34549,31188,533
5694,Breakfast,"Grapefruit (Solids and Liquids, Light Syrup Pack, Canned)",35824,33087,152
5119,Breakfast,"Rice Puddings (Dry Mix, with Whole Milk)",39455,45697,34
5166,Breakfast,Apple Cider,5588,20375,117
5555,Dinner,Coconut Milk (with Water),3395,10687,552
5599,Breakfast,Date Candy,7278,26080,107
7498,Breakfast,Cheese Crackers,38933,38910,5
150,Breakfast,"Beef Outside Skirt Steak (Lean Only, Trimmed to 1/4"" Fat)",37702,36547,234
2804,Breakfast,Roasted Dark Turkey Meat,1751,4690,31
7567,Breakfast,Air Popped  Popcorn,4337,14238,31
2086,Breakfast,"Australian Lamb Loin (Lean Only, Trimmed to 1/8"" Fat)",38730,38405,41
3751,Breakfast,Wheat or Cracked Wheat English Muffin,3629,11975,129
5612,Breakfast,Dried Fig,5342,22882,47
2259,Breakfast,Chow Fun Noodles with Meat and Vegetables,5047,20167,192
4017,Breakfast,Meatless Enchilada with Beans,4816,18455,178
6854,Breakfast,Instant Grits (Fat Not Added in Cooking),4459,15744,157
6797,Breakfast,"Cooked String Beans (from Canned, Fat Not Added in Cooking)",6368,23064,27
2424,Breakfast,Pork Ears (Frozen),36114,33662,264
4138,Breakfast,New England Clam Chowder (with Milk),3051,12252,149
3856,Breakfast,Oat Flour (Partially Debranned),39797,45979,115
859,Breakfast,"Beef Top Loin (Trimmed to 0"" Fat, Cooked, Broiled)",37427,36028,164
5367,Dinner,Berry Pie (Two Crust),4065,15268,434
2962,Dinner,Turkey Tetrazzini (Frozen Meal),2947,10544,398
8678,Dinner,Mexican Style Beef Stew (Carne Guisada Sin Papas),2190,9051,459
8199,Breakfast,Fondant Candies,39370,45619,106
9179,Breakfast,Dried Beechnuts,37045,35311,163
4739,Breakfast,Brown Rice (Fat Not Added in Cooking),4512,15918,215
9073,Breakfast,"Cooked String Beans (from Canned, Fat Added in Cooking)",6342,23852,60
4462,Dinner,"Greenland Halibut (Fish) (Cooked, Dry Heat)",38156,37442,380
5528,Breakfast,Marshmallow Cookie with Coconut,3994,15441,76
1364,Breakfast,"Chicken Drumstick Meat (Broilers or Fryers, Fried, Cooked)",34457,30993,82
1779,Breakfast,Reduced Calorie High Fiber Soft White Roll,3499,12148,84
6587,Breakfast,"Pancakes (Dry Mix, Prepared)",39008,39142,62
4785,Breakfast,"Macaroni (Protein Fortified, Enriched, Cooked)",39772,40385,189
7110,Breakfast,Pizza with Seafood,4901,17827,252
1818,Breakfast,Smoked Turkey Wing (Skin Eaten),1780,5445,206
369,Breakfast,"Beef Brisket (Point Half, Trimmed to 0"" Fat, Cooked, Braised)",37363,35914,304
4937,Breakfast,Spaghetti with Meat Sauce (Entree),40155,40860,255
2704,Breakfast,Pork Egg Roll in A Bowl,23430136,21888277,269
5285,Breakfast,Cranberry-Apricot Juice (Bottled),37836,36778,157
175,Breakfast,"Beef Shank Crosscuts (Trimmed to 1/4"" Fat, Choice Grade)",37284,35775,50
8287,Breakfast,Shumai Dumpling,5940012,5763413,57
2093,Breakfast,"Lamb Leg (Whole (Shank and Sirloin) Trimmed to 1/4"" Fat, Choice Grade)",38434,37848,65
8970,Breakfast,Presweetened Leaf Tea with Sugar Decaffeinated,7479,28348,47
3491,Dinner,Frankfurter or Hot Dog with Chili and Cheese on Bun,2844,11862,390
1920,Breakfast,Ground Pork,36208,33833,224
82,Breakfast,Smoked Beef Sausage Stick,1849,4780,46
816,Breakfast,"Beef Tenderloin (Trimmed to 1/8"" Fat, Cooked, Broiled)",37646,36459,227
9081,Breakfast,Cooked Green String Beans with Mushroom Sauce (Canned),6859,25291,116
1091,Breakfast,Stewed Chicken Leg (Skin Not Eaten),1667,4922,165
4396,Breakfast,Baked or Broiled Trout,2094,7667,43
7594,Breakfast,Baked Potato Skins,5725,20823,63
5568,Breakfast,Frozen Milk Dessert Bar or Stick (with Coconut),1174,547,197
283,Breakfast,"Beef Knuckle (Tip Side, Steak, Lean Only, Trimmed to 0"" Fat)",40295,41119,267
6124,Breakfast,"Peas and Onions (Without Salt, Frozen, Drained, Cooked, Boiled)",36478,34364,81
4120,Breakfast,Fried Floured or Breaded Catfish,1965,6119,180
8432,Breakfast,Elk Meat,38585,38149,31
609,Breakfast,Beef Pastrami (Cured),37349,35887,41
2915,Breakfast,Egg Omelet or Scrambled Egg with Sausage and Mushrooms,3128,9846,155
1813,Breakfast,Sesame Flour Seeds (High Fat),37100,35421,149
1271,Breakfast,Breaded Chicken Parmigiana Patty with Vegetable (Diet Frozen Meal),2917,11368,307
9019,Lunch,Salted Margarine-Like Spread made with Yogurt Stick,7004,26823,1430
10133,Breakfast,Abalone (Mixed Species),38116,37362,89
2994,Breakfast,Turkey Nuggets,1786,5965,46
9319,Breakfast,"Cinnamon Coffeecake (with Crumb Topping, Unenriched)",39102,39374,263
7524,Breakfast,Cuban Crackers,4267,16443,20
6409,Dinner,"Mashed Potato made with Milk, Fat and Egg (from Dry)",5786,22985,635
6104,Breakfast,"Green Peas (Without Salt, Frozen, Drained, Cooked, Boiled)",36470,34353,197
8770,Breakfast,"Royal Red Kidney Beans (Without Salt, Cooked, Boiled)",38247,37580,218
2642,Breakfast,"Pork Shoulder Steaks (Boston Blade, Lean Only, Cooked, Broiled)",36105,33646,193
7362,Breakfast,Cooked Yellow Corn (Fat Added in Cooking),6420,23866,210
4508,Breakfast,"Northern Pike (Fish) (Cooked, Dry Heat)",38027,37172,175
2305,Breakfast,"Pork Chops (Center Loin, Bone-In, Lean Only, Cooked, Braised)",36060,33562,172
7308,Breakfast,Corn,6243,24356,132
9070,Breakfast,Cooked Yellow String Beans (from Fresh),6322,23010,77
4195,Breakfast,Dungeness Crab,38104,37337,73
5562,Breakfast,Chocolate Cookie (made with Oatmeal and Coconut),3964,13690,98
4840,Breakfast,Chunky Style Turkey Noodle Soup,3018,10661,177
4655,Breakfast,Sardine Fish Oil,34317,30707,123
8626,Breakfast,Non-Chocolate Coating Marshmallow Pies,3998,15381,143
4168,Breakfast,Fried Battered Cod,1972,7994,196
3849,Breakfast,Oat Bran,39710,40316,231
10394,Breakfast,Butternut Winter Squash,36598,34561,63
8864,Breakfast,Caramel Coated Cookie with Nuts,3954,15545,70
5253,Breakfast,Cooked Dried Apricot,5334,18811,212
10106,Breakfast,Raw Vegetable,6223,22455,24
5533,Breakfast,Coconut Water (Canned or Bottled),3398,10990,133
2414,Breakfast,Pork Steak or Cutlet (Lean Only Eaten),1461,2534,203
3554,Breakfast,"Oats Cereal (Without Salt, Cooked with Water, Unenriched)",35421,32624,147
4691,Breakfast,Shrimp (Canned),38113,37355,128
4498,Breakfast,"Perch (Mixed Species, Cooked, Dry Heat)",38025,37168,54
2195,Breakfast,"Lamb Shoulder Whole (Arm and Blade, Trimmed to 1/4"" Fat, Choice Grade, Cooked, Broiled)",38460,37901,236
5045,Breakfast,Rice with Vegetables,5134,17117,170
2600,Breakfast,"Pork Leg (Rump Half, Cooked, Roasted)",36032,33506,340
6163,Breakfast,Pineapple (Traditional Varieties),36015,33477,70
6373,Breakfast,Tang (Dry Concentrate),7680,29087,52
1518,Breakfast,Chicken Soup with Dumplings,5229,19124,96
4764,Dinner,Lasagna with Cheese and Sauce (Diet Frozen Meal),5167,19270,427
4314,Breakfast,Sheepshead (Fish),38061,37247,257
3366,Breakfast,100% Whole Wheat Bread,3566,11477,69
6058,Breakfast,Cooked Dry Green or Yellow Split Peas (Fat Not Added in Cooking),3246,11007,229
6804,Lunch,Tuna Pot Pie,2550,8863,1707
7391,Breakfast,"Cooked Vegetable Combinations (Broccoli, Carrots, Corn and Cauliflower)",6738,25374,88
6309,Breakfast,"Fajita-Style Beef Sandwich with Cheese, Lettuce and Tomato on Pita Bread",2777,11141,292
2633,Breakfast,"Pork Shoulder (Arm Picnic, Lean Only, Cured, Roasted)",36162,33745,144
7952,Breakfast,Fat Free Chocolate Ice Cream,1179,2276,229
5633,Breakfast,Cooked Dried Peach with Sugar,5352,19027,284
8652,Breakfast,Chinese Cabbage (Pe-Tsai),36316,34028,12
5922,Breakfast,Pear,5457,19618,96
9824,Breakfast,Cooked Spinach (Fat Added in Cooking),5957,20967,78
9285,Breakfast,Cheese and Spinach Filled Stuffed Shells,5032,18512,113
2434,Breakfast,Pork and Vegetables in Soy-Based Sauce (Mixture),2625,9782,258
8738,Breakfast,Puerto Rican Style Stewed Red Beans with Pig's Feet and Potatoes,3237,11727,328
7585,Breakfast,Potato,5718,21213,174
7917,Breakfast,No Sugar Added Light Ice Cream,1151,2307,212
7423,Breakfast,Light Corn Syrup,39566,40122,62
6064,Breakfast,"Cooked Mixed Vegetables (Corn, Lima Beans, Peas, Green Beans and Carrots, from Frozen, Fat Added in Cooking)",6653,24464,151
4520,Breakfast,Baked or Broiled Swordfish,2090,8879,41
5587,Breakfast,"Cranberry Juice Cocktail (Low Calorie, with Calcium, Saccharin and Corn Sweetener, Bottled)",37839,36784,45
3545,Breakfast,Frosted Oat Cereal with Marshmallows,4683,16944,109
6691,Breakfast,Meatless Brown Nut Gravy,3391,11104,19
8611,Lunch,Lemon Pie Filling,5269,18637,923
9302,Breakfast,Lowfat Frozen Whipped Topping,1094,1611,165
5531,Dinner,Coconut Cream Puddings (Dry Mix),39552,40088,382
5444,Dinner,Blueberry Pie Filling,5505,17832,474
517,Breakfast,"Beef Chuck (Mock Tender Steak, Trimmed to 1/4"" Fat, Select Grade)",40359,46510,31
6851,Breakfast,Cooked Kohlrabi (Fat Not Added in Cooking),6546,25787,48
6160,Breakfast,Pineapple Cream Pie,4115,14065,289
7701,Breakfast,Hard Pretzels,4350,17448,228
9590,Breakfast,"Hubbard Winter Squash (Without Salt, Cooked, Baked)",36603,34567,102
8537,Breakfast,Citrus Fruit Juice Drink,7543,28783,114
7203,Breakfast,Lowfat Frozen Milk Dessert Bar with Low Calorie Sweetener,1184,559,25
1415,Breakfast,Chicken Meat (Stewing),34510,42483,126
4664,Breakfast,Fried Battered Scallops,2177,8449,37
4456,Breakfast,Fried Floured or Breaded Haddock,1996,8316,175
2761,Breakfast,Veal Ribs (Lean Only),38536,38052,102
6481,Breakfast,"Milk (Nonfat, Dry, Instant)",33824,29498,243
5911,Breakfast,"Dried Peaches (with Added Sugar, Sulfured, Stewed)",35914,33285,278
4855,Breakfast,"Egg Noodles (Without Added Salt, Cooked)",39817,40434,221
9359,Breakfast,"Ready-to-Serve Low Sodium Vegetable Soup (Prepared with Water, Canned)",6845,25459,77
127,Breakfast,"Beef Chuck (Blade Roast, Trimmed to 1/4"" Fat)",37169,35552,216
3474,Breakfast,Cheeseburger with Mayonnaise or Salad Dressing on Bun,2715,8865,347
6358,Breakfast,Cooked Dry Chickpeas (Fat Not Added in Cooking),3245,10734,295
8534,Breakfast,Carbonated Noncitrus Juice Drink,7530,28152,141
4310,Breakfast,Wild Channel Catfish,37974,37056,151
2438,Breakfast,Fresh Pork Sausage,35174,32304,170
3765,Breakfast,Toasted Wheat Bran English Muffin,3626,12281,126
7713,Breakfast,Gingerbread Cake without Icing,3848,14114,213
6729,Breakfast,Cooked Ground Hog,1613,4182,58
6432,Breakfast,Cocoa Powder with Nonfat Dry Milk and Low Calorie Sweetener (Dry Mix),1049,1727,57
7018,Breakfast,"Chocolate Breakfast Powder (Instant, Sugar-Free, Not Reconstituted)",40717,41668,20
6972,Breakfast,Instant Flavored Grits (Fat Not Added in Cooking),4462,17444,169
10314,Breakfast,Pickled Plum,5480,19413,34
1473,Breakfast,Szechuan Chicken,7550857,7278340,179
6340,Breakfast,Whole Dry Milk (Reconstituted),819,145,156
4821,Breakfast,Noodles,4409,16826,219
7755,Dinner,Rice Salad with Tuna,3037652,2957757,376
3560,Breakfast,"Yellow Corn Grits Cereal (Without Salt, Cooked with Water, Unenriched)",35458,32679,143
3951,Breakfast,Bolillo Mexican Roll,3512,12308,198
49,Breakfast,Beef Sausage,1847,6099,42
5437,Breakfast,Blueberry Pancakes,39010,39149,84
10447,Breakfast,Stewed Tomatoes (Canned),6151,23137,66
887,Dinner,"Beef Top Round (Trimmed to 0"" Fat, Cooked, Broiled)",37687,36528,515
6261,Breakfast,"Taco or Tostada with Beans, Cheese, Meat, Lettuce, Tomato and Salsa",4836,16546,151
6043,Breakfast,"Cooked Snowpea (Pea Pod) (from Fresh, Fat Added in Cooking)",6609,22725,101
2616,Dinner,"Pork Roasts (Center Rib, Bone-In, Cooked, Roasted)",36066,33574,571
516,Dinner,"Beef Chuck (Mock Tender Steak, Trimmed to 1/4"" Fat, Choice Grade)",40357,41210,517
3168,Breakfast,Toasted Bagel with Fruit (Other Than Raisins),3545,10809,286
2949,Breakfast,"Sirloin Tips with Gravy, Potatoes and Vegetable (Frozen Meal)",2882,10599,329
1424,Lunch,Chicken Meat and Skin (Capons),34520,31128,2256
139,Breakfast,"Beef Chuck (Blade Roast, Trimmed to 1/4"" Fat, Choice Grade)",37170,35554,231
1924,Breakfast,Ground Pork (Frozen),36222,43972,63
2378,Breakfast,Pickle and Pimiento Pork Loaf,35169,32295,86
3197,Breakfast,Toasted Wheat Bagel with Fruit and Nuts,3618,13981,197
5131,Breakfast,Puerto Rican Style White Rice (Arroz Blanco),4529,18522,333
112,Breakfast,"Beef Ribs (Large End, Trimmed to 1/4"" Fat, Prime Grade)",37222,35653,107
4559,Breakfast,Fried Floured or Breaded Sturgeon,2087,8639,63
4595,Breakfast,Cooked Mussels,2163,6933,12
8178,Breakfast,Fruit Salad with Cream Substitute (Excluding Citrus Fruits),5558,20605,145
3250,Breakfast,White Bread (Home Recipe or Bakery),3435,11431,125
4690,Breakfast,Dried Shrimp,2182,8216,13
8243,Breakfast,Churros,4223,15082,116
3697,Lunch,Millet,39708,40314,756
4546,Breakfast,Whiting,2110,7671,30
7646,Breakfast,"Mashed Potato made with Milk, Sour Cream and/or Cream Cheese (from Fresh)",5779,19643,262
3277,Breakfast,Barley Bread,3695,12472,73
8739,Breakfast,Red Tomatoes,36633,34621,22
7403,Breakfast,"Yellow Sweet Corn (with Salt, Drained, Cooked, Boiled)",36798,34876,96
4068,Breakfast,Tortilla Chips (White Corn),39333,39704,138
4408,Breakfast,"Salmon Nuggets (Breaded, Frozen)",38210,45186,54
6896,Breakfast,"Cooked Yellow and White Corn (from Canned, Fat Not Added in Cooking)",6569,23103,133
9067,Breakfast,Baby Food Green String Beans,6943,23345,4
8231,Breakfast,Meringues,3172,12002,71
3222,Dinner,Ham On Biscuit,2789,11069,363
9926,Breakfast,Cooked Eggplant,6525,24515,66
451,Dinner,Beef with Cream or White Sauce (Mixture),2200,9055,361
3731,Dinner,Bacon and Egg Croissant Sandwich,4979,18983,398
9456,Breakfast,"Asparagus (Drained Solids, Canned)",36249,33898,3
4986,Breakfast,Rigatoni with Meat Sauce and Cheese (Diet Frozen Meal),5185,18085,254
3663,Breakfast,Instant Cream Of Wheat (Fat Not Added in Cooking),4543,18735,133
2763,Breakfast,Venison/Deer Ribs,1607,4619,32
