,meal_type,food_name,food_id,serving_id,calories
895,Breakfast,"Beef Top Round (Trimmed to 1/4"" Fat, Select Grade, Cooked, Braised)",37413,36003,199
3247,Breakfast,Italian Bread,38793,38560,54
2326,Breakfast,"Pork Chops (Loin Blade, Bone-In, Cooked, Braised)",36048,33538,275
7096,Breakfast,"Onions (Without Salt, Frozen, Drained, Cooked, Boiled)",36450,34315,59
9071,Breakfast,Cooked String Beans (Fat Added in Cooking),6341,23984,83
8337,Breakfast,Grits,4442,17256,109
10283,Breakfast,Peanut Butter (Reduced Sodium),40655,41573,101
5038,Breakfast,Puerto Rican Style Cornmeal (Harina De Maize Con Leche),4469,18352,295
6450,Breakfast,"Low Sodium, Dry Beef Broth, Bouillon or Consomme,",2972,10051,11
4136,Breakfast,Clams Casino,2399,11106,34
9845,Breakfast,Chocolate Covered Diet or Low Calorie Candy,7412,27329,17
1715,Breakfast,"Chicken Vegetable Soup (Canned, Condensed)",34744,31542,150
1698,Breakfast,Chicken or Turkey and Noodles with Cream or White Sauce (Mixture),2369,11232,320
10231,Breakfast,Porcupine Balls with (Mushroom) Soup (Mixture),2330,8596,282
10082,Breakfast,Chicory Roots,36342,34088,44
10525,Breakfast,Ranch Salad Dressing (Reduced Fat),34348,30753,33
8683,Breakfast,"Milk (Other Than Whole, 1% or Skim)",799,13,108
3831,Breakfast,Wheat Bran Muffins (Toaster Type),39003,39130,106
6299,Breakfast,Curry Powder,33877,29585,6
3348,Breakfast,Puerto Rican Style Caressed Bread (Pan Sobao),3446,12330,68
10049,Breakfast,Kale,36398,34192,34
985,Breakfast,Lowfat Beef Bologna,1857,5496,57
1821,Dinner,Turkey Wing Meat and Skin,34580,31251,504
4571,Breakfast,"Grouper (Fish) (Mixed Species, Cooked, Dry Heat)",37996,37102,238
587,Breakfast,"Beef Knuckle (Tip Side, Steak, Lean Only, Trimmed to 0"" Fat, Cooked, Grilled)",40296,41120,282
10299,Breakfast,"Cola or Pepper Soda (Low Calorie with Aspartame, Contains Caffeine)",37913,36920,7
5077,Dinner,White Rice (Long-Grain),39821,40438,675
5345,Breakfast,Banana Cake,3793,14928,323
7895,Breakfast,Soft Serve Light Ice Cream (Flavors Other Than Chocolate),1155,2312,220
8785,Lunch,Roasted Mixed Nuts,3364,10686,886
10053,Breakfast,"Cooked Kale (from Canned, Fat Added in Cooking)",5926,23693,86
10521,Breakfast,Puerto Rican Style Codfish Salad (Serenata),2696,8969,257
5483,Breakfast,Red Sour Cherries,35771,33011,52
2990,Lunch,Turkey Back,1783,4748,1263
9798,Breakfast,Cooked Cauliflower (from Frozen),6540,25528,67
5514,Breakfast,Dried Coconut,37062,35339,187
8375,Dinner,Meat Turnover with Gravy,4962,18982,378
7739,Dinner,Nut Cake with Icing,3867,14045,421
9353,Breakfast,"Reduced Sodium Cream of Mushroom Soup (Prepared with Water, Canned)",6833,26750,66
9371,Breakfast,"Pepperpot Soup (with Equal Volume Water, Canned)",34981,31944,104
5553,Breakfast,No Flour Coconut Meringue Macaroon,3993,15013,97
3557,Breakfast,Oat Bran Cereal (Fat Added in Cooking),4571,15853,148
1395,Breakfast,"Chicken Wing Meat and Skin (Broilers or Fryers, Stewed, Cooked)",34489,31068,100
264,Dinner,"Beef Tenderloin (Trimmed to 1/8"" Fat, Prime Grade)",37654,36478,388
7644,Breakfast,Potato From Puerto Rican Beef Stew with Gravy,5741,22041,118
3547,Breakfast,Whole Wheat Cereal,4557,15755,113
6844,Breakfast,"Cooked Kale (from Canned, Fat Not Added in Cooking)",5922,20296,46
8361,Breakfast,Horseradish,33916,29670,7
6788,Breakfast,Cooked Eggplant in Tomato Sauce (Fat Not Added in Cooking),6800,23125,76
3069,Dinner,Veal and Noodles with Cream or White Sauce (Mixture),2362,8350,376
7549,Breakfast,Low Sodium Wheat Crispbread,4282,18263,34
9153,Breakfast,Tomato Soup (Prepared with Water),6207,22191,76
5025,Dinner,Yellow Bolted Self-Rising Cornmeal (Enriched),39701,40305,407
8859,Breakfast,Fortune Cookie,3986,13866,30
3864,Breakfast,Oats,4764,17158,311
9579,Breakfast,"Indian Pudding (Milk, Molasses and Cornmeal-Based Pudding)",1207,1299,313
2400,Breakfast,Turkey Pastrami,1925,7130,35
6274,Breakfast,Cheese Pizza Topping,1328,1599,48
8950,Breakfast,Herbal Tea,7586,28705,2
10348,Breakfast,"Pumpkin (Without Salt, Drained, Cooked, Boiled)",36552,34483,49
7962,Breakfast,Sponge Snack Cake (Creme Filled),38861,38732,157
3711,Breakfast,Frosted Shredded Wheat,7210303,6958965,154
246,Dinner,Fried Battered Beef Steak (Lean Only Eaten),1372,2888,364
1594,Breakfast,"Oriental Chicken or Turkey Garden Salad (Chicken and/or Turkey, Lettuce, Fruit, Nuts)",2655,10930,102
10223,Breakfast,Mushroom Gravy,3081,9402,64
1529,Dinner,Honey Garlic Chicken,12212152,11591257,486
8682,Breakfast,Skim or Nonfat Milk (Calcium Fortified),798,8,86
923,Breakfast,Ground Beef (75% Lean / 25% Fat),40411,41320,246
8602,Dinner,Plum Pie (Two Crust),4088,14289,441
7329,Breakfast,Cooked Corn (from Fresh),6567,24381,210
4364,Breakfast,Fresh Water Bass (Mixed Species),37967,37042,90
669,Breakfast,"Beef Ribs (Large End, Trimmed to 0"" Fat, Select Grade, Cooked, Roasted)",37375,35937,281
3604,Breakfast,"Oats Cereal (Instant, Prepared with Water, Fortified)",35423,32627,129
5108,Lunch,White Rice (Medium-Grain),39825,40442,702
1910,Breakfast,Duck Fat,34301,30661,115
7276,Breakfast,Potato Chips (Unsalted),39636,40235,152
8806,Breakfast,Roasted European Chestnuts,37098,44788,69
5248,Breakfast,Apricot Unsweetened in Water Pack (Cooked or Canned),5382,21853,10
7183,Breakfast,Fat Free Fruit Filled Cookie Bar,3982,14084,62
3958,Breakfast,Leather Fruit Rolls,39300,39649,78
6957,Breakfast,Cooked Lentils (Fat Not Added in Cooking),3255,10780,220
6026,Breakfast,"Cooked Green Peas (from Canned, Fat Added in Cooking)",6698,24348,150
5643,Breakfast,Unsweetened Cooked Dried Peach,5351,17213,199
2696,Breakfast,"Lowfat Smoked Turkey, Pork and Beef Sausage",1902,7578,39
2591,Breakfast,"Pork Chitterlings (Cooked, Simmered)",36113,33660,198
5906,Breakfast,"Peaches (Solids and Liquids, Light Syrup Pack, Canned)",35906,33274,136
1781,Breakfast,Reduced Calorie High Fiber Oat Bran Bread,3669,13348,58
6509,Dinner,"Lemon Puddings (Instant, Dry Mix)",39554,40092,374
3013,Breakfast,Light Turkey Meat,1742,5855,27
7133,Dinner,Taco,39919,40526,568
2307,Breakfast,"Pork Chops (Top Loin, Boneless, Lean Only)",36085,33610,33
10318,Breakfast,Hawaiian Style Pickled Radishes,6813,25562,42
3690,Dinner,Dry Instant Cream Of Wheat Cereals,35407,32603,651
687,Breakfast,"Beef Ribs (Large End, Trimmed to 1/8"" Fat, Select Grade, Cooked, Broiled)",37579,36319,275
6011,Breakfast,"Cowpeas, Field Peas or Blackeye Peas (from Fresh, Fat Added in Cooking)",6576,25229,192
7071,Breakfast,Green String Beans with Onions (Fat Added in Cooking),6644,24096,88
612,Breakfast,"Beef Porterhouse Steak (Lean Only, Trimmed to 0"" Fat, Choice Grade, Cooked, Broiled)",37449,36069,190
9786,Breakfast,Creamed Cauliflower (Canned),6753,24063,249
7167,Breakfast,Fat Free Cereal Crust Breakfast Bar with Fruit Filling,4241,15359,124
8370,Breakfast,Meatless Lo Mein,5050,17063,254
3200,Breakfast,100% Whole Wheat Bagel with Raisins,3584,12597,256
2267,Breakfast,Chocolate Chip Cookie with Raisins,3958,14572,24
10325,Breakfast,"Potatoes (Drained Solids, Canned)",36513,34432,108
6629,Lunch,Gingerbread Cake (Dry Mix),38853,38716,1796
4135,Breakfast,Reduced Sodium New England Clam Chowder (Canned),3053,12702,123
1898,Breakfast,Roasted Duck (Skin Not Eaten),1793,5763,126
10062,Breakfast,"Kale (with Salt, Drained, Cooked, Boiled)",36817,34904,36
282,Breakfast,"Beef Porterhouse Steak (Trimmed to 0"" Fat, Select Grade, Cooked, Broiled)",37445,36061,227
258,Breakfast,Chipped Dried Beef,1414,2774,174
2924,Breakfast,Steak Sauce (Tomato Base),6186,22453,152
10110,Breakfast,Mixed Pickles,6882,26723,212
4943,Breakfast,Meat Filled Ravioli,5002,17058,306
2822,Lunch,"Turkey Back Meat and Skin (Young Tom, Cooked, Roasted)",34655,31397,904
6529,Breakfast,"Dolphinfish (Cooked, Dry Heat)",38154,37438,173
3339,Breakfast,Toasted Soy Bread,3701,13658,71
3525,Dinner,Puerto Rican Style Yam Buns (Bunuelos De Name),5851,21795,464
4563,Breakfast,"Rainbow Smelt (Fish) (Cooked, Dry Heat)",38064,37252,105
10197,Breakfast,"Vegetable Salad (Without Dressing, with Turkey, Ham and Cheese)",39894,40500,267
6697,Breakfast,Wheat Based Brown Rice Cakes (Unsalted),39644,40251,153
5329,Breakfast,Strawberry Banana Orange Juice,5324,18810,108
5223,Breakfast,Baby Food Junior Apple Raspberry,5628,20847,10
2285,Breakfast,Chocolate Chip Cookies (Soft Type),38884,38786,69
6063,Breakfast,"Ready-to-Serve Reduced Sodium Split Pea and Ham Soup (with Water, Canned)",3319,11733,172
8078,Breakfast,Poultry Salad Sandwich Spread,35178,32311,26
4654,Dinner,Sardine Sandwich with Lettuce and Spread,2829,11072,492
5000,Dinner,Meatless Cheese Filled Tortellini with Vegetables and Vinaigrette Dressing,5039,18530,373
6710,Breakfast,Blue Corn Mush with Ash (Navajo),40560,46647,15
9846,Breakfast,Plum Drained Solids (Cooked or Canned),5478,19359,28
7764,Breakfast,Marble Cake without Icing,3863,12494,137
484,Breakfast,"Beef Chuck (Clod Roast, Trimmed to 1/4"" Fat, Cooked, Braised)",40387,41268,206
2211,Breakfast,Pork Chop (Lean Only Eaten),1437,2439,92
5416,Breakfast,Frozen Raspberries with Sugar,5524,19567,258
475,Breakfast,"Beef Chuck (Clod Roast, Lean Only, Trimmed to 0"" Fat, Choice Grade, Cooked, Braised)",37665,36502,145
2555,Dinner,Kung Pao Pork,2610,10184,462
8087,Breakfast,Vanilla Sandwich Cookies (with Creme Filling),38929,38893,48
7,Breakfast,"Beef Top Sirloin (Trimmed to 1/8"" Fat, Select Grade)",37662,36496,268
6411,Breakfast,"Low Sodium Cream of Vegetable Soup (Prepared with Water, Made From Dry Mix)",7116,26126,191
9678,Breakfast,"Beef Broth Soup (Condensed, Canned)",35061,32110,54
9417,Breakfast,Japanese Chestnuts,37113,35444,44
5546,Lunch,Coconut Milk or Cream (Liquid),37066,35345,792
2426,Breakfast,Broiled or Baked Pork Steak or Cutlet (Lean and Fat Eaten),1466,2997,316
6744,Breakfast,"Cooked Hot Peppers (from Fresh, Fat Not Added in Cooking)",6726,25088,57
10164,Breakfast,Cocoa Butter Vegetable Oil,34261,30558,120
2274,Breakfast,Meatless Chow Fun Noodles with Vegetables,5048,17190,161
1577,Breakfast,"Slice Meatless Beef, Chicken, Salami or Turkey",3329,9542,26
7264,Breakfast,Chia Pudding,16722956,15782300,232
3970,Breakfast,Lowfat Chocolate Frozen Yogurt Cone,886,841,102
5879,Breakfast,Papaya in Sugar or Syrup (Cooked or Canned),5443,21375,100
8893,Breakfast,Puerto Rican Cookies (Mantecaditos Polvorones),4051,15671,97
9848,Breakfast,"Reduced Sodium Cream of Mushroom Soup (Undiluted, Canned)",6834,26098,131
7193,Breakfast,"Peanuts, Oats, Sugar and Wheat Germ Granola Bar",4248,16007,206
3867,Breakfast,Portuguese Sweet Potato Bread,7873014,7581019,78
9940,Breakfast,Garlic,6246,23659,4
6823,Breakfast,Cooked Christophine (Fat Not Added in Cooking),6473,25197,30
7548,Breakfast,No Added Fat Wheat Crispbread,4291,16214,32
781,Breakfast,"Beef T-Bone Steak (Trimmed to 0"" Fat, Select Grade, Cooked, Broiled)",37459,36092,196
1749,Breakfast,Minced Pork and Chicken Luncheon Meat (Canned),35282,43213,56
6519,Breakfast,"Yellow Cake (Dry Mix, Unenriched, Pudding Type)",39105,39380,122
5774,Breakfast,Waxgourd (Chinese Preserving Melon),36670,34690,17
2324,Breakfast,"Pork Chops (Top Loin, Boneless, Lean Only, Cooked, Braised)",36086,43951,48
5055,Breakfast,Converted White Rice,4500,15916,213
9526,Breakfast,"Cooked Vegetable Combination with Soy-Based Sauce (Including Carrots, Broccoli, and/or Dark-Green Leafy)",6874,24187,83
1727,Breakfast,Chicken Gravy (Canned),34824,31702,188
610,Breakfast,Beef Pork Salami (Dry or Hard),35183,32320,104
4666,Breakfast,Scalloped Potato,5760,19795,217
5413,Breakfast,Frozen Boysenberries,5507,19566,66
8103,Breakfast,Keto Sushi,24760668,23014006,28
8174,Breakfast,Gelatin Dessert with Fruit and Whipped Topping,7379,27383,234
3750,Breakfast,Wheat Bran English Muffin,3625,11389,127
97,Breakfast,"Beef Brisket (Whole, Lean Only)",37162,35538,176
6985,Breakfast,Cooked Spaghetti Squash (Fat Not Added in Cooking),6620,23278,42
3137,Breakfast,Veal Shoulder Whole (Arm and Blade),38539,38058,37
1537,Breakfast,Chicken Vegetable Soup,14947182,14137075,134
3648,Dinner,Whole Wheat and Rolled Oats Cereal with Pecans,4662,15820,379
1517,Dinner,Chicken or Turkey Salad,2651,10825,417
9976,Breakfast,Cooked Mustard Greens (from Canned),5935,19593,58
4624,Breakfast,Oyster Mushroom,37004,35245,52
6566,Breakfast,"Chocolate Puddings (Dry Mix, with 2% Milk)",39451,45694,31
2090,Breakfast,Lamb Curry,2235,9064,257
7097,Breakfast,"14"" Pepperoni Pizza",40054,40728,298
6171,Breakfast,Prune Juice,5605,18602,182
7521,Breakfast,Wheat Crackers (Low Salt),39113,39415,9
572,Breakfast,Beef Frankfurter (Low Fat),40611,41513,133
9581,Dinner,Baked Beans with Franks (Canned),38221,37548,368
3062,Breakfast,"Veal Breast (Plate Half, Cooked, Braised)",38691,38338,240
597,Dinner,"Beef Lungs (Cooked, Braised)",37328,35856,364
6633,Breakfast,"Onion Soup Mix (Dry, Dehydrated)",34802,31658,118
7875,Breakfast,Summer Squash Casserole with Rice and Tomato Sauce,6778,26250,110
7345,Breakfast,Chili Con Carne without Beans,2194,8454,272
6304,Breakfast,Enchilada with Cheese,39911,40518,319
9966,Breakfast,Cooked Greens (from Canned),5906,19590,79
5976,Breakfast,Creamed Peas and Carrots,6065,23707,222
1938,Breakfast,"Ham (Whole, Cured, Roasted)",36155,33734,207
8100,Breakfast,Sushi with Egg rolled in Seaweed,5109,19751,32
1753,Breakfast,"Chicken Noodle Soup (with Equal Volume Water, Canned)",34965,31906,75
3670,Breakfast,Millet (Fat Not Added in Cooking),4477,18307,205
8500,Breakfast,"Bison Meat (Lean Only, Cooked, Roasted)",38576,38132,122
2361,Breakfast,Pork Meatballs,546239,570488,47
4260,Breakfast,Northern Pike (Fish),38026,37170,174
5432,Breakfast,Juneberry,5430,19315,94
6285,Dinner,Cheeseburger (Double Patty),39929,40537,457
8345,Breakfast,Instant Grits (Fat Added in Cooking),4460,17442,257
9991,Breakfast,Cooked Dandelion Greens (Fat Added in Cooking),5896,21664,67
8307,Breakfast,Bakwan,17502313,16505830,137
9035,Breakfast,"Margarine (Spread, Approx. 60% Fat, Hydrogenated Soybean and Cottonseed, Tub)",34233,30509,26
5591,Breakfast,Canned Cranberry-Orange Relish,35788,43707,50
1171,Breakfast,Baked or Fried Coated Chicken Thigh Skinless,1710,4554,143
7927,Breakfast,No Bake Cookies,4747576,4621474,115
8515,Breakfast,Pepper-Type Soft Drink,7623,28641,137
9873,Breakfast,"Cooked Okra (from Fresh, Fat Added in Cooking)",6483,22646,68
8638,Breakfast,Pumpkin Pie Spice,33897,29626,6
9677,Breakfast,Chunky Beef Stroganoff Soup (Canned),35112,32203,235
874,Breakfast,"Beef Top Round (Lean Only, Trimmed to 1/4"" Fat, Choice Grade, Cooked, Braised)",37417,36011,181
2297,Breakfast,"Pork Chops (Sirloin, Boneless, Cooked, Broiled)",36201,33819,177
10102,Breakfast,Mixed Vegetables (Frozen),36664,34679,182
2643,Lunch,"Pork Spareribs (Whole, Cooked, Braised)",36108,33652,703
5347,Breakfast,"Banana Puddings (Dry Mix, Instant, with 2% Milk)",39391,45638,30
10488,Breakfast,Pasta or Macaroni Salad with Oil and Vinegar-Type Dressing,5092,18853,250
581,Breakfast,"Beef Knuckle (Tip Center, Steak, Lean Only, Trimmed to 0"" Fat, Choice Grade, Cooked, Grilled)",37715,36563,293
204,Breakfast,Beef and Rice with Tomato-Based Sauce (Mixture),2324,10308,303
7896,Breakfast,No Sugar Added Fat Free Ice Cream (Flavors Other Than Chocolate),1177,549,156
2014,Breakfast,"Lamb Leg (Whole (Shank and Sirloin) Lean Only, Trimmed to 1/4"" Fat, Choice Grade)",38436,37852,145
905,Breakfast,"Beef Top Sirloin (Lean Only, Trimmed to 0"" Fat, Cooked, Broiled)",37436,36044,156
631,Breakfast,"Beef Retail Cuts Composite (Lean Only, Trimmed to 0"" Fat, Cooked)",37356,35901,179
8811,Breakfast,Roasted and Toasted Whole Sesame Seeds,37026,35275,160
1974,Dinner,"Ham or Pork, Noodles and Vegetables in Cheese Sauce (Mixture)",2468,8508,441
162,Breakfast,Fried Beef,1357,1246,85
4998,Breakfast,Spinach Filled Tortellini with Tomato Sauce,5044,19999,244
4713,Breakfast,"Shrimp (Mixed Species, Cooked, Breaded and Fried)",38111,37351,206
1431,Breakfast,Chicken Meat (Cornish Game Hens),34681,31444,277
6868,Breakfast,"Cooked Mushrooms (from Fresh, Fat Not Added in Cooking)",6456,25213,44
9651,Breakfast,Beef Stew with Potatoes and Vegetables in Gravy,2436,8507,209
7710,Dinner,Dobos Torte Cake (Non-Chocolate Layer Cake with Chocolate Filling and Icing),3845,14455,491
7736,Breakfast,Diet Carrot Cake,3804,14452,178
4283,Breakfast,Atlantic Salmon (Farmed),38196,37517,156
7531,Breakfast,"Cheese Crackers (with Peanut Butter Filling, Sandwich Type)",38934,38912,193
8431,Breakfast,Beaver Meat,38571,38121,41
3384,Breakfast,Toasted Raisin Bread (Enriched),38806,38595,71
10098,Breakfast,"Mashed Winter Type Squash (No Sugar Added in Cooking, Fat Added in Cooking)",6103,21174,127
8594,Breakfast,Squash Pie,4120,13959,291
8809,Breakfast,Oil Roasted Peanuts (with Salt),38299,45274,170
7462,Breakfast,Olive Corn and Peanut Oil,40808,46890,251
3331,Breakfast,100% Whole Wheat Bread with Raisins,3570,11445,66
6404,Breakfast,Cooked Dry Beans (Fat Not Added in Cooking),3185,10726,220
2096,Breakfast,"Lamb Loin (Lean Only, Trimmed to 1/4"" Fat, Choice Grade)",38449,37878,41
8870,Breakfast,Sugar Wafer Cookie,4031,15858,18
7999,Breakfast,Ice Cream Cones (Cake or Wafer Type),38990,39092,17
5017,Dinner,Cornmeal Dumpling,4470,16762,401
1449,Breakfast,"Sliced Chicken Breast (Mesquite Flavor, Fat Free)",35305,32480,34
6900,Dinner,Vegetarian Pot Pie,3336,11959,508
2610,Breakfast,"Pork Loin (Whole, Lean Only, Cooked, Braised)",36044,33530,173
1900,Breakfast,"Duck Meat (Roasted, Cooked)",34527,31143,281
8186,Breakfast,Diet Gelatin Dessert with Fruit and Cream Cheese (Sweetened with Low Calorie Sweetener),7234,26417,143
3920,Breakfast,Whole Wheat Dinner Rolls,39053,39247,114
2757,Breakfast,"Pork Beef Kielbasa (Kolbassy, Nonfat, Dry Milk Added)",35152,32262,88
6397,Dinner,Cooked Dry Chickpeas (Fat Added in Cooking),3244,10136,399
10254,Breakfast,"Cooked Okra (from Frozen, Fat Added in Cooking)",6484,24689,85
2097,Breakfast,Lamb Tongue,38639,38237,63
5624,Lunch,Yogurt Covered Raisins,7307,27452,751
3471,Dinner,Fish Sandwich with Spread on Bun,2826,11544,400
8266,Breakfast,Nut and Honey Waffle,4377,15092,129
2171,Breakfast,"Lamb Ribs (Trimmed to 1/4"" Fat, Choice Grade, Cooked, Roasted)",38454,37889,305
9749,Breakfast,"Cabbage (Without Salt, Drained, Cooked, Boiled)",36309,34012,278
9699,Breakfast,Cooked Broccoli with Cheese Sauce (from Frozen),6017,23884,214
2010,Breakfast,"Lamb Cubed For Stew or Kabob (Lean Only, Trimmed to 1/4"" Fat)",38482,37944,152
10336,Breakfast,Cooked Pumpkin (Fat Added in Cooking),6094,20554,115
1283,Breakfast,Chicken and Vegetable Entree with Noodles (Diet Frozen Meal),2934,12697,280
10134,Breakfast,"Abalone (Mixed Species, Cooked, Fried)",38117,37363,161
1019,Breakfast,"Canadian-Style Bacon (Cured, Grilled)",36141,33708,87
2810,Breakfast,"Turkey Dark Meat (Young Hen, Cooked, Roasted)",34629,31346,269
9114,Breakfast,"Lettuce Salad with Cheese, Tomato and/or Carrots",6281,24421,78
1651,Breakfast,Cream of Chicken or Turkey Soup (with Milk),3034,11704,174
10149,Breakfast,Tomatoseed Vegetable Oil,34268,30579,120
1169,Breakfast,Baked or Fried Coated Chicken Thigh with Skin,1707,4540,211
6256,Breakfast,"Taco or Tostada with Fish, Lettuce, Tomato and Salsa",4833,16864,98
5469,Breakfast,Sour Cherry Soup,5577,21512,206
867,Breakfast,"Beef Top Round (Lean Only, Trimmed to 0"" Fat, Choice Grade, Cooked, Braised)",37418,36013,176
5093,Breakfast,"White Rice (Long-Grain, with Salt, Cooked)",39836,40454,205
5433,Breakfast,Blackberry Juice (Canned),35758,43677,11
541,Dinner,"Beef Chuck (Top Blade, Lean Only, Trimmed to 1/4"" Fat, Select Grade)",37694,36538,585
10384,Breakfast,Cooked Spinach with Cheese Sauce (from Fresh),5967,19870,170
6354,Breakfast,Fruit-Flavored Thirst Quencher Beverage (Dry Concentrate),7642,29017,48
9855,Breakfast,Cream of Shrimp Soup,3059,12499,127
3390,Breakfast,Puerto Rican Style Toasted Caressed Bread (Pan Sobao),3447,9930,69
8504,Breakfast,Soursop Nectar (Guanabana),5621,21515,160
10487,Dinner,Macaroni or Pasta Salad,5084,18796,358
3959,Breakfast,Rye Melba Toast (Includes Pumpernickel),38940,38936,19
6643,Breakfast,"Tomato Vegetable Soup Mix (Dry, Dehydrated)",34806,31666,62
6841,Breakfast,"Cooked Collards (from Frozen, Fat Not Added in Cooking)",5877,21346,61
8760,Breakfast,"Red Cabbage (Without Salt, Drained, Cooked, Boiled)",36311,34021,22
3586,Breakfast,Whole Wheat Hot Natural Cereal (Dry),35441,32654,321
8543,Breakfast,Sugar Free Decaffeinated Cola Soft Drink,7499,28912,4
2563,Breakfast,"Pork and Ham Luncheon Meat (Minced, Canned)",35281,32455,176
5036,Dinner,White Degermed Self-Rising Cornmeal (Enriched),39811,40428,490
1080,Breakfast,Baked or Fried Coated Chicken Drumstick with Skin (Skin/Coating Eaten),1690,4974,194
5891,Breakfast,Peach Nectar,5617,20203,134
4966,Breakfast,"Dry Spaghetti (Protein Fortified, Enriched, 2)",39838,40456,213
2023,Breakfast,"Australian Lamb Leg (Sirloin Chops, Boneless, Trimmed to 1/8"" Fat, Cooked, Broiled)",38721,38396,200
10276,Dinner,Peanut Butter Smoothie,19906366,18736746,360
7909,Lunch,No Crust Ice Cream Pie,1145,2291,1747
10101,Breakfast,"Mixed Vegetables (Drained Solids, Canned)",36663,34678,80
7321,Breakfast,Cooked Dried Corn,6415,24557,214
226,Breakfast,"Beef Flank (Trimmed to 0"" Fat, Select Grade)",37699,44909,164
1013,Breakfast,"Bacon (Cured, Microwaved, Cooked)",36233,33868,38
1929,Breakfast,"Ham Patties (Cured, Grilled)",36152,33727,205
5251,Breakfast,"Apricots (Solids and Liquids Without Skin, Heavy Syrup Pack, Canned)",35743,32954,214
2179,Breakfast,"Lamb Shoulder Arm (Trimmed to 1/4"" Fat, Choice Grade, Cooked, Roasted)",38469,37919,237
697,Breakfast,"Beef Ribs (Small End, Lean Only, Trimmed to 1/4"" Fat, Prime Grade, Cooked, Roasted)",37248,35706,258
1124,Breakfast,Fried Chicken No Coating (Skin Not Eaten),1634,2212,15
7378,Breakfast,"Cooked Yellow Corn (from Canned, Fat Added in Cooking)",6517,25220,166
8676,Breakfast,"Chocolate Milk Shake (with Skim Milk, Flavors Other Than Chocolate)",930,849,189
5110,Breakfast,Flavored Rice and Pasta Mixture,5155,20172,206
7902,Breakfast,Puerto Rican Sugar Cane Beverage,7655,28764,183
1778,Breakfast,Reduced Calorie High Fiber Italian Bread,3474,12198,43
8441,Breakfast,"Caribou Meat (Cooked, Roasted)",38582,38144,142
2634,Breakfast,"Pork Shoulder (Blade Roll, Cured)",36163,33746,76
7544,Breakfast,"Cheese Crackers (with Cheese Filling, Sandwich Type)",39281,39624,191
7604,Breakfast,Meat Potato and Vegetable Turnover,4967,20158,257
3489,Dinner,Double Cheeseburger with Mayonnaise or Salad Dressing on Bun,2721,8834,529
1037,Breakfast,Turkey Bologna,35127,32226,59
9953,Breakfast,Cooked Green Tomatoes (from Fresh),6154,22968,198
2649,Lunch,"Pork Trimmed Retail Cuts (Leg, Loin, Shoulder and Spareribs, Cooked)",36180,33777,3478
2979,Breakfast,Turkey Dark Meat and Skin (Young Tom),34648,31383,231
2547,Breakfast,Pork and Vegetables (Mixture),2616,10218,211
5132,Breakfast,Apples,35718,32915,72
2159,Breakfast,"Lamb Leg (Sirloin Half, Trimmed to 1/8"" Fat, Choice Grade, Cooked, Roasted)",38654,38265,241
6445,Breakfast,Tapioca Pudding with Milk (Dry Mix),1204,1297,177
3967,Breakfast,Ice Cream Cone (Flavors Other Than Chocolate),1130,536,166
1428,Breakfast,"Chicken Meat (with Broth, Canned)",34662,42635,94
8885,Breakfast,Fat Free Chocolate Cookie with Chocolate Filling or Coating,3966,13581,55
2520,Dinner,"Pork Roasts (Center Loin, Bone-In, Lean Only, Cooked, Roasted)",36062,33566,460
8033,Dinner,Tuna Melt Sandwich,2832,9892,350
9115,Breakfast,"Seafood Garden Salad with Seafood (Tomato and/or Carrots, Other Vegetables)",2675,10829,40
10418,Breakfast,Winter Type Squash,6105,21689,48
448,Breakfast,"Beef, Tofu and Vegetables in Soy-Based Sauce (Including Carrots, Broccoli, and/or Dark-Green Leafy, No Potatoes (Mixture)",2585,11242,258
8956,Breakfast,Presweetened Decaffeinated Tea,7475,27665,47
5995,Breakfast,Cooked Peas with Mushroom Sauce (from Fresh),6929,26317,198
8494,Breakfast,Beluga Whale Meat (Alaska Native),40496,46583,31
3727,Breakfast,Cheese Croissant,3534,12917,174
7353,Breakfast,Cooked Yellow and White Corn (Canned),6423,24122,166
6279,Breakfast,Thick Crust Cheese Pizza with Fruit,4887,18839,307
9445,Breakfast,Asparagus Creamed or with Cheese Sauce (Canned),6853,24291,179
7295,Breakfast,Maple and Corn and/or Cane Pancake Syrup Blends,7370,24952,53
6251,Dinner,"Burrito with Beans, Cheese and Chili Peppers",39902,40508,662
5926,Breakfast,Pear Nectar,5620,19839,150
2460,Breakfast,Fried Pork Steak or Cutlet (Lean Only Eaten),1470,2805,266
22,Breakfast,"Beef Round (Full Cut, Trimmed to 1/8"" Fat, Select Grade)",37598,36357,52
2066,Breakfast,Lamb Liver,38618,38209,39
1653,Dinner,Dominican Style Stuffed Rice with Chicken (Arroz Relleno Dominicano),5111,20170,568
1376,Breakfast,Chicken Neck Meat and Skin (Broilers or Fryers),34469,31022,45
1724,Breakfast,Chicken Vegetable Soup (Low Sodium),35106,32195,166
3754,Breakfast,Toasted Raisin Cinnamon English Muffins (Includes Apple Cinnamon),38982,39075,144
4183,Breakfast,"Lingcod (Fish) (Cooked, Dry Heat)",38159,37448,165
4082,Breakfast,Puerto Rican Style Ripe Plantain Omelet (Tortilla De Amarillo),3143,12747,206
6579,Breakfast,"Yellow Cake (Dry Mix, Pudding Type)",38870,38749,120
4558,Breakfast,Baked or Broiled Sturgeon,2085,8565,31
3537,Breakfast,Marshmallow Cookie with Rice Cereal,3995,13842,115
7003,Breakfast,"Cooked Young Green Onions (from Fresh, Fat Not Added in Cooking)",6601,24390,5
10526,Breakfast,Low Calorie or Diet Mayonnaise-Type Salad Dressing,7169,24886,38
646,Lunch,"Beef Retail Cuts Composite (Trimmed to 1/4"" Fat, Select Grade, Cooked)",37147,35512,824
6381,Dinner,Shoo-Fly Pie,4141,16718,404
7527,Breakfast,Graham Cracker Cake,3849,13816,158
10238,Breakfast,Creamed Mushrooms (from Fresh),6772,26549,176
7165,Breakfast,Breakfast Bar,4239,15083,181
8448,Breakfast,Ground Bison Meat,38748,45379,63
7697,Breakfast,Unsalted Hard Pretzel,4352,16805,8
9931,Breakfast,Ratatouille,6708,26245,154
4875,Breakfast,Vegetable Noodle Soup (Prepared with Water),6912,24235,72
9074,Breakfast,"Cooked Yellow String Beans (from Canned, Fat Added in Cooking)",6348,21778,60
5341,Dinner,"Banana Puddings (Instant, Dry Mix)",39546,40080,363
